[
  {
    "id": "consulta-tecnica",
    "nome": "Consulta técnica",
    "descricao": "Mostra uma dica sobre o passo atual.",
    "cooldown": 2,
    "efeito": { "tipo": "dica" }
  },
  {
    "id": "analise-rapida",
    "nome": "Análise rápida",
    "descricao": "Risca a pior opção de uma decisão.",
    "cooldown": 3,
    "efeito": { "tipo": "eliminarPior" }
  },
  {
    "id": "recuperacao",
    "nome": "Recuperação",
    "descricao": "Recupera 25 de energia.",
    "cooldown": 4,
    "efeito": { "tipo": "energia", "valor": 25 }
  },
  {
    "id": "foco-total",
    "nome": "Foco total",
    "descricao": "O próximo desafio vale 20% a mais.",
    "cooldown": 5,
    "efeito": { "tipo": "bonusDesafio", "percentual": 20 }
  }
]
